authorid,Author,Title,Summary,summary_credit,bookImgId,Pubdate,Language,Publisher,City,Country,Pub_id,Genre,Sub_Genre,Translation,Buy_Link,Read_Link,Listen_Link,Length,lon,lat,PublisherList
bhambley,Barbara Hambly,The Ladies of Mandrigyn,"When the women of the City of Mandrigyn, led by Sheera Galernas, hired the mercenary army of Captain Sun Wolf, to help them rescue their men from the mines of evil, he refused. Little did he realize how insistent the ladies could be, and how far they would go to persuade him to train them against the evil of Altiokis",,bhambley5,1984,English,Ballantine Books,"New York, NY",United States,new_york_ny_united¬†states,Fiction (Novel),,n,https://www.amazon.com/Ladies-Mandrigyn-Sun-Wolf-Starhawk/dp/0345309197,https://www.google.com/books/edition/The_Ladies_of_Mandrigyn/PxyzWl5tXk8C?hl=en&gbpv=1&pg=PT7&printsec=frontcover,#,311,-73.9814,40.7636,
bhambley,Barbara Hambly,The Time of the Dark,"As a student of medieval history, Gil Patterson is a woman familiar with dark stories. She knows well the Crusades, the Black Death, and the other horrors of the Middle Ages, but it is another kind of atrocity that has begun to haunt her dreams. She sees forces of evil assaulting a beleaguered kingdom, whose kind people are on the brink of annihilation, and awakes each morning in a cold sweat. Gil dismisses the dreams until a wizard appears in her apartment. He has crossed into her dimension, passing through the fraying fabric of the universe, to ask her help. For mankind to survive he must protect an infant prince, whom he plans to hide in Gil's world. The student of history is about to get much closer to evil than she ever imagined.",,bhambley1,1982,English,Ballantine Books,"New York, NY",United States,new_york_ny_united¬†states,Fiction (Novel),"Science Fiction,Fantasy",n,https://www.amazon.com/Time-Dark-Darwath-Trilogy-Book/dp/0345319656,https://www.google.com/books/edition/The_Time_of_the_Dark/JbUyZDPwgTwC?hl=en&gbpv=1&pg=PT8&printsec=frontcover,#,263,-73.9814,40.7636,
bhambley,Barbara Hambly,Ishmael,"The U.S.S. Enterprise is on a peaceful mission at Starbase 12 when a bizarre cosmic phenomenon causes a Klingon ship to suddenly vanish -- with Spock aboard for the ride. Spock's last message from the Klingon ship is cryptic and frightening. The Klingons are traveling into the past, searching for the one man who holds the key to the furure. If they can kill that man, the course of history will be changed -- and the Federation will be destroyed!",,bhambley6,1985,English,Pocket Books,"New York, NY",United States,new_york_ny_united¬†states,Fiction (Novel),,n,https://www.amazon.com/Ishmael-Star-Trek-Barbara-Hambly/dp/0671660896,https://www.google.com/books/edition/Ishmael/vrdLSXcFQ_UC?hl=en&gbpv=1&pg=PT4&printsec=frontcover,#,255,-73.98089274,40.75885179,
bhambley,Barbara Hambly,Kindred of Darkness,"When James Asher and his wife Lydia's baby daughter Miranda is kidnapped by the Master Vampire of London, the stakes are high: blindly follow the Master Vampire's instructions, keep out of the way of the human networks that serves the vampires, destroy the interloper who seeks to seize control of the London Nest, and find the key to the Nest's tortuous inner workings: The Book of the Kindred of Darkness.

Even with the vampire Don Simon Ysidro on their side, there's no guarantee that anything - or anyone - is who or what they appear to be. Nor is there any certainty that they'll see their child again - or survive the experience themselves.",,bhambley39,2013,English,Severn House,London,United Kingdom,london_united¬†kingdom,Fiction (Novel),,n,#,#,#,256,-0.1975556427,51.50830554,
bhambley,Barbara Hambly,Scandal in Babylon,"1924. After six months in Hollywood, young British widow Emma Blackstone has come to love her new employer, glamourous movie-star Kitty Flint – even if her late husband’s sister is one of the worst actresses she’s ever seen. Looking after Kitty and her three adorable Pekinese dogs isn’t work Emma dreamed of, but Kitty rescued her when she was all alone in the world. Now, the worst thing academically-minded Emma has to worry about is the shocking historical inaccuracies of the films Kitty stars in.

Until, that is, Rex Festraw – Kitty’s first husband, to whom she may or may not still be married – turns up dead in her dressing room, a threatening letter seemingly from Kitty in his pocket.

Emma’s certain her flighty but kind-hearted sister-in-law has been framed. But who by? And why? From spiteful rivals to jealous boyfriends, the suspects are numerous. But as Emma investigates, she begins to untangle a deadly plot – and there’s something Kitty’s not telling her . . .

This gripping first in a brand-new series from NYT-bestselling author Barbara Hambly brings the sights and sounds of Hollywood to life and is a perfect pick for fans of female-fronted historical mysteries set in the roaring twenties.",,bhambley47,2021,English,Severn House,London,United Kingdom,london_united¬†kingdom,Fiction (Novel),,n,https://www.amazon.com/Scandal-Babylon-Silver-historical-mystery/dp/0727890387,https://www.amazon.com/Scandal-Babylon-Silver-historical-mystery/dp/0727890387?asin=B094V5BTBX&revisionId=ea79635b&format=3&depth=1,#,240,-0.1975556427,51.50830554,
bhambley,Barbara Hambly,Blood Maidens,"It's 1911. War is coming, and according to one of the vampires of St. Petersburg, the Kaiser is trying to recruit vampires. James Asher, Oxford don and formerly on His Majesty's Secret Service, is forced to team up again with his vampire partner Don Simon Ysidro for a journey to the subarctic Russian capital. Are they on the trail of a rogue vampire with a plan to achieve the power to walk in daylight? Asher wonders. Or is Ysidro's real agenda to seek the woman he once loved? ",,bhambley34,2010,English,Severn House,London,United Kingdom,london_united¬†kingdom,Fiction (Novel),,n,https://www.amazon.com/Blood-Maidens-Barbara-Hambly/dp/0727869477,https://www.google.com/books/edition/Blood_Maidens/FKCpBQAAQBAJ?hl=en&gbpv=1&pg=PT10&printsec=frontcover,#,256,-0.1975556427,51.50830554,
bhambley,Barbara Hambly,Crimson Angel,"When Jefferson Vitrack – the white half-brother of Benjamin January’s wife - turns up on January’s doorstep in the summer of 1838 claiming he has discovered a clue to the whereabouts of the family’s lost treasure, January has no hesitation about refusing to help look for it. For the treasure lies in Haiti, the island that was once France’s most profitable colony – until the blood-chilling repression practiced there by the whites upon their slaves triggered a savage rebellion. The world’s only Black Republic still looks with murderous mistrust upon any strangers who might set foot there, and January is in no hurry to go.

But when Vitrack is murdered, and attempts are made on January’s wife and himself, he understands that he has no choice. He must seek the treasure himself, to draw the unknown killers into the open, a bloody trail that leads first to Cuba, then to Haiti, and finally to the secret that lies buried with the accursed gold.",,bhambley41,2014,English,Severn House,Surrey,England,surrey_england,Fiction (Novel),,n,https://www.amazon.com/Crimson-Angel-Benjamin-January-historical/dp/0727884271,https://www.google.com/books/edition/Crimson_Angel/klupBQAAQBAJ?hl=en&gbpv=1&pg=PT11&printsec=frontcover,#,384,-0.1975556427,51.50830554,
bhambley,Barbara Hambly,Darkness on His Bones,"Simon. Something frightful has happened to Jamie. Please come . . .

When James Asher is found unconscious in the cemetery of the Church of St. Clare Pieds-Nus with multiple puncture-wounds in his throat and arms, his wife, Lydia, knows of only one person to call: the vampire Don Simon Ysidro. Old friend and old adversary, he is the only one who can help Lydia protect her unconscious, fevered husband from the vampires of Paris.

Why James has been attacked – and why he was called to Paris in the first place – Lydia has no idea. But she knows that she must find out, and quickly. For with James wavering between life and death, and war descending on the world, their slim chance of saving themselves from the vampires grows slimmer with each passing day",,bhambley42,2015,English,Severn House,London,United Kingdom,london_united¬†kingdom,Fiction (Novel),,n,https://www.amazon.com/Crimson-Angel-Benjamin-January-historical/dp/0727884271,https://www.google.com/books/edition/Darkness_on_His_Bones/AYVjCgAAQBAJ?hl=en&gbpv=1&pg=PT11&printsec=frontcover,#,256,-0.1975556427,51.50830554,
bhambley,Barbara Hambly,Dead and Buried: A Benjamin January Mystery,"New Orleans, 1836. When free black musician and surgeon Benjamin January attends the funeral of a friend, an accident tips the dead man out of his coffin - only to reveal an unexpected inhabitant. Just one person recognises the corpse of the white man: Hannibal Sefton, fiddle-player and one of January's closest friends. But he seems unwilling to talk about his connection to the dead man",,bhambley35,2010,English,Severn House,London,United Kingdom,london_united¬†kingdom,Fiction (Novel),,n,https://www.amazon.com/Dead-Buried-Benjamin-January-Mystery/dp/0727868675,https://www.google.com/books/edition/Dead_and_Buried/yp-pBQAAQBAJ?hl=en&gbpv=1&pg=PT7&printsec=frontcover,#,256,-0.1975556427,51.50830554,
bhambley,Barbara Hambly,Good Man Friday,"New Orleans, 1838. When Benjamin January suddenly finds that his services playing piano at extravagant balls held by the city's wealthy are no longer required, he ends up agreeing to accompany sugar planter Henri Viellard and his young wife, Chloë, on a mission to Washington to find a missing friend. Plunged into a murky world, it soon becomes clear that while it is very possible the Viellards' friend is dead, his enemies are very much alive - and ready to kill anyone who gets in their way.",,bhambley40,2013,English,Severn House,London,United Kingdom,london_united¬†kingdom,Fiction (Novel),,n,https://www.amazon.com/Good-Friday-Benjamin-January-Mystery/dp/1847514707,https://www.google.com/books/edition/Good_Man_Friday/lLKpBQAAQBAJ?hl=en&gbpv=1&pg=PT10&printsec=frontcover,#,256,-0.1975556427,51.50830554,
bhambley,Barbara Hambly,The House of the Patriarch,"New Orleans, 1840. Freshly home from a dangerous journey, that last thing Benjamin January wants to do is leave his wife and young sons again. But when old friends Henri and Chloe Viellard ask for his help tracking down a missing girl in distant New York, he can't say no.

Three weeks ago, seventeen-year-old Eve Russell boarded a steam-boat - and never got off it. Mrs Russell is adamant Eve's been kidnapped, but how could someone remove a teenager from a crowded deck in broad daylight? And why would anyone target Eve?

The answer lies in New York, a hotbed of new religions and beliefs, of human circuses and freak shows . . . and of blackbirders, who'll use any opportunity to kidnap a free man of color and sell him into slavery. January's determined to uncover the truth, but will he ever be able to return to New Orleans to share it?",,bhambley46,2020,English,Severn House,London,United Kingdom,london_united¬†kingdom,Fiction (Novel),,n,https://www.amazon.com/House-Patriarch-Benjamin-January-Mystery/dp/0727889907,https://www.google.com/books/edition/House_of_the_Patriarch/09LsDwAAQBAJ?hl=en&gbpv=1&pg=PT10&printsec=frontcover,#,256,-0.1975556427,51.50830554,
bhambley,Barbara Hambly,Lady of Perdition,"April, 1840. Benjamin January knows no black person in their right mind would willingly go to the Republic of Texas but when his former pupil Selina Bellinger is kidnapped and enslaved, he has no choice. Once there he is saved from being hanged by Valentina Taggart, wife of the wealthy landowner of Rancho Perdition.

After Valentina is accused of the murder of her husband, she in turn calls on Benjamin for help. To do so, he must abandon the safe haven of New Orleans, where people know he's a free man, to return to the self-proclaimed ""Slaveholders' Republic"".

In a land still disputed between vengeful Comanche, disgruntled Mexican Tejanos, Americans who want to join the United States and those who want to keep Texas free, January must uncover what happened to Valentina's husband. Behind lies, betrayals and rising political tensions lies the answer . . . but finding it could cost Ben his life.",,bhambley45,2019,English,Severn House,London,United Kingdom,london_united¬†kingdom,Fiction (Novel),,n,https://www.amazon.com/Lady-Perdition-Benjamin-January-Mystery/dp/0727889095,https://www.google.com/books/edition/Lady_of_Perdition/R5exDwAAQBAJ?hl=en&gbpv=1&pg=PT8&printsec=frontcover,#,256,-0.1975556427,51.50830554,
bhambley,Barbara Hambly,Pale Guardian,"The vampires call them ‘The Others’. Neither living nor dead, the revenants are mindless and unstoppable – and in the carnage of the First World War, governments already running short of men to throw into battle might be very interested in soldiers who don’t ask questions and are hard to kill. Front-line volunteer nurse Lydia Asher is horrified to learn that someone has found a way to control revenants, and is creating them for this purpose.

Back in London, Lydia’s husband, former spy James Asher, is even more appalled to learn that revenants are beginning to show up in England, on the loose. Since revenants devour vampires, the vampires of Europe – most of whom are at the Front, feeding completely unnoticed on the dying – join forces with the Ashers to find the source of the threat before the world is overwhelmed.",,bhambley43,2017,English,Severn House,London,United Kingdom,london_united¬†kingdom,Fiction (Novel),,n,https://www.amazon.com/Pale-Guardian-Vampire-Mystery-James/dp/0727886770,https://www.google.com/books/edition/Pale_Guardian/3xILDgAAQBAJ?hl=en&gbpv=1&pg=PT9&printsec=frontcover,#,256,-0.1975556427,51.50830554,
bhambley,Barbara Hambly,Prisoner of Midnight,"March, 1917. The goal of every government involved in the Great War has been achieved: industrialist Spenser Cochran has drugged and enslaved a vampire, Don Simon Ysidro, to do his bidding, and is now on the way to the US aboard a luxury ship.

Horrified, Dr Lydia Asher secures her passage on the vessel to rescue her friend from Cochran’s chemical thrall. Meanwhile, her husband makes a dangerous alliance with the vampires of Paris to send Lydia the information she needs about the drug.

As they cross the Atlantic evidence mounts that another vampire is hiding aboard the ship, indiscriminately murdering passengers. Lydia knows she must solve both cases before the ship docks, and that breaking Cochran’s hold on Don Simon will not be enough . . . She must kill him.",,bhambley44,2019,English,Severn House,London,United Kingdom,london_united¬†kingdom,Fiction (Novel),,n,https://www.amazon.com/Prisoner-Midnight-James-Asher-Vampire/dp/0727888609,https://www.google.com/books/edition/Prisoner_of_Midnight/e4N-DwAAQBAJ?hl=en&gbpv=1&pg=PT9&printsec=frontcover,#,247,-0.1975556427,51.50830554,
bhambley,Barbara Hambly,Ran Away,"RAN AWAY. So began a score of advertisements every week in the New Orleans newspapers, advertising for slaves who'd fled their masters. But the Turk, Hüseyin Pasha, posted no such advertisement when his two lovely concubines disappeared. And when a witness proclaimed he'd seen the 'devilish infidel' hurl their dead bodies out of a window, everyone was willing to believe him the murderer. Only Benjamin January, who knows the Turk of old, is willing to seek for the true culprit, endangering his own life in the process",,bhambley37,2011,English,Severn House,London,United Kingdom,london_united¬†kingdom,Fiction (Novel),,n,https://www.amazon.com/Ran-Away-Benjamin-January-Mystery/dp/0727880829,https://www.google.com/books/edition/Ran_Away/cKapBQAAQBAJ?hl=en&gbpv=1&pg=PT8&printsec=frontcover,#,256,-0.1975556427,51.50830554,
bhambley,Barbara Hambly,Shirt on His Back,"Abishag Shaw is seeking vengeance for his brother's murder - and Benjamin January is seeking money after his bank crashes. Far beyond the frontier, in the depths of the Rocky Mountains, both are to be found at the great Rendezvous of the Mountain Men: a month-long orgy of cheap booze, shooting-matches, tall tales and cut-throat trading. But at the rendezvous, the discovery of a corpse opens the door to hints of a greater plot, of madness and wholesale murder",,bhambley36,2011,English,Severn House,London,United Kingdom,london_united¬†kingdom,Fiction (Novel),,n,https://www.amazon.com/Shirt-Back-Benjamin-January-Mysteries/dp/1847513360,https://www.google.com/books/edition/Shirt_on_His_Back/WJ6pBQAAQBAJ?hl=en&gbpv=1&pg=PT7&printsec=frontcover,#,256,-0.1975556427,51.50830554,
bhambley,Barbara Hambly,Magistrates of Hell,"October, 1912. James Asher, his wife Lydia, and the old occultist and vampire-hunter Dr Solomon Karlebach have journeyed to the new-born Republic of China to investigate the rumour that the mindless Undead – the Others that even the vampires fear – have begun to multiply in the caverns of the hills west of Peking. Alongside his old vampire partner, Don Simon Ysidro, Asher embarks on a sinister hunt, while somewhere in the city’s cold gray labyrinth lurk the Peking vampires, known as the Magistrates of Hell – with an agenda of their own",,bhambley38,2012,English,Severn House,London,United Kingdom,london_united¬†kingdom,Fiction (Novel),,n,https://www.amazon.com/Magistrates-James-Asher-Vampire-Novel/dp/1847514227,https://www.google.com/books/edition/The_Magistrates_of_Hell/_0GpBQAAQBAJ?hl=en&gbpv=1&pg=PT10&printsec=frontcover,#,244,-0.1975556427,51.50830554,
bhambley,Barbara Hambly,The Nubian’s Curse,"December 1840. Surgeon turned piano-player Benjamin January is looking forward to a peaceful holiday with his family. But the arrival of an old friend brings unexpected news - and unexpected danger.

Persephone Jondrette has found Arithmus: a Sudanese man with extraordinary mental abilities who January last saw in France, nearly fifteen years ago, during a ghost-hunting expedition to a haunted chateau. January and his friends survived the experience . . . but Arithmus' benefactor, the British explorer Deverel Wishart, did not. He was discovered dead one morning, his face twisted in horror, and shortly afterwards Arithmus vanished, never to be seen again.

Did Deverel succumb to the chateau's ghosts - or did Arithmus murder him and run away? January is determined to uncover the truth about the tragic incident from his past, and clear his old friend's name - but even he isn't prepared for what happens next",,bhambley49,2024,English,Severn House,London,United Kingdom,london_united¬†kingdom,Fiction (Novel),,n,https://www.amazon.com/Nubians-Benjamin-January-Historical-Mystery/dp/1448311365,https://www.google.com/books/edition/The_Nubian_s_Curse/KPfJEAAAQBAJ?hl=en&gbpv=1&pg=PT10&printsec=frontcover,#,332,-0.1975556427,51.50830554,
bhambley,Barbara Hambly,Those Who Hunt the Night,"At the turn of the twentieth century, a former spy is called into service to hunt down a vampire killer...

Once a spy for Queen Victoria, James Asher has fought for Britain on every continent, using his quick wits to protect the Empire at all costs. After years of grueling service, he marries and retires to a simple academic’s life at Oxford. But his peace is shattered one night with the arrival of a Spanish vampire named Don Simon. Don Simon can disappear into fog, move faster than the eye can see, and immobilize Asher—and his young bride—with a wave of his hand. Asher is at his mercy, and has no choice but to give his help.

Because someone is killing the vampires of London, and James Asher must find out who—before he becomes a victim himself.",,bhambley11,1988,English,Unwin Paperbacks,London,United Kingdom,london_united¬†kingdom,Fiction (Novel),,n,https://www.amazon.com/gp/product/0345361326?ref_=dbs_m_mng_rwt_calw_tmmp_0&storeType=ebooks,https://www.google.com/books/edition/Those_Who_Hunt_the_Night/38bc4zvDvqoC?hl=en&gbpv=1&pg=PT7&printsec=frontcover,#,350,-0.1393754227,51.5045974,
bjenkins,Barbara Jenkins,Sic Transit Wagon and other stories,N/A,,bjenkins1,2013,English,Peepal Tree Press,,,leeds_ldn_england,Fiction (Short Story Collection),,,#,#,#,,-1.5694,53.8062,
bjenkins,Barbara Jenkins,De Rightest Place,N/A,,bjenkins2,2018,English,Peepal Tree Press,"Leeds, LDN",England,leeds_ldn_england,Fiction (Novel),,n,#,#,#,278,-1.5694,53.8062,
bjenkins,Barbara Jenkins,The Stranger Who Was Myself,N/A,,bjenkins3,2022,English,Peepal Tree Press,,,leeds_ldn_england,Memoir,,,#,#,#,,-1.5694,53.8062,
blalla,Barbara Lalla,Language in exile : three hundred years of Jamaican Creole,N/A,,blalla1,1990,English,University of Alabama Press,"Tuscaloosa, AL",United States,alabama_united_states,Nonfiction,,n,#,#,#,253,-87.54172165,33.21680629,
blalla,Barbara Lalla,Defining Jamaican fiction : marronage and the discourse of survival,N/A,,blalla2,1996,English,University of Alabama Press,"Tuscaloosa, AL",United States,alabama_united_states,Nonfiction,,n,#,#,#,224,-87.54172165,33.21680629,
blalla,Barbara Lalla,Arch of fire,N/A,,blalla3,1998,English,Kingston Publishers,Kingston,Jamaica,kingston_jamaica,Fiction (Novel),,n,#,#,#,523,-76.81250203,18.01711571,
blalla,Barbara Lalla,Postcolonialisms : Caribbean rereading of medieval English discourse,N/A,,blalla6,2008,English,The University of The West Indies Press,Kingston,Jamaica,kingston_jamaica,Nonfiction,,n,#,#,#,439,-76.74395075,17.99924991,
blalla,Barbara Lalla,Cascade : a novel,N/A,,blalla7,2010,English,The University of The West Indies Press,Cave Hill,Barbados,cave_hill_barbados,Fiction (Novel),,n,#,#,#,299,-76.74395075,17.99924991,
blalla,Barbara Lalla,Grounds For Tenure,N/A,,blalla8,2017,English,The University of The West Indies Press,Kingston,Jamaica,kingston_jamaica,Fiction (Novel),,n,#,#,#,361,-76.74395075,17.99924991,
blalla,Barbara Lalla,One thousand eyes,N/A,,blalla9,2021,English,The University of The West Indies Press,Kingston,Jamaica,kingston_jamaica,Fiction (Novel),,n,#,#,#,303,-76.74395075,17.99924991,
blalla,Barbara Lalla,Virtual realism : constraints on validity in textual evidence of Caribbean history,N/A,,blalla5,2005,English,Society for Caribbean Linguistics,St. Augustine,Trinidad & Tobago,st._augustine_trinidad_&¬†tobago,Nonfiction,,n,#,#,#,20,-61.39948338,10.6414336,
blalla,Barbara Lalla,Flammendes Land Roman,N/A,,blalla4,2001,German,Verl.-Haus,Wetzlar,Germany,wetzlar_germany,Fiction (Novel),,y,#,#,#,537,8.503377353,50.56353162,
bphilippe,Ben Philippe,"Sure, I'll Be Your Black Friend: Notes From The Other Side Of The Fist Bump",N/A,,bphilippe3,2021,English,Harper,"New York, NY",United States,new_york_ny_united_states,Fiction (Novel),,n,#,#,#,320,-74.00987081,40.71094262,
bphilippe,Ben Philippe,The Field Guide to the North American Teenager,N/A,,bphilippe1,2019,English,Balzer + Bray,,,new_york_ny_united_states,Fiction (Novel),,,#,#,#,,-73.98110965,40.71575604,
bphilippe,Ben Philippe,Charming as a Verb,N/A,,bphilippe2,2020,English,Balzer + Bray,,,new_york_ny_united_states,Fiction (Novel),,,#,#,#,,-73.98110965,40.71575604,
bmontabo,Bernard Montabo,Le Palais Des Jésuites: Roman,N/A,,bmontabo1,2002,French,Ibis Rouge,Petit-Bourg,Guadeloupe,petit_bourg_guadeloupe,Fiction (Novel),,n,#,#,#,346,-52.3361093,4.850304291,
bmontabo,Bernard Montabo,Vodún - roman,N/A,,bmontabo4,2004,French,Ibis Rouge,Matoury,French Guiana,matoury_french_guiana,Fiction (Novel),,n,#,#,#,319,-52.3361093,4.850304291,
bmontabo,Bernard Montabo,Le Camp Du Portugais: Le Palais Des Jésuites 3 : Roman,N/A,,bmontabo5,2007,French,Ibis Rouge,Petit-Bourg,Guadeloupe,petit_bourg_guadeloupe,Fiction (Novel),,n,#,#,#,311,-52.3361093,4.850304291,
bmontabo,Bernard Montabo,Guyane,N/A,,bmontabo10,2016,French,Editions Orphie,Matoury,French Guiana,matoury_french_guiana,Nonfiction,,n,#,#,#,511,55.94673229,-20.81345706,
bmontabo,Bernard Montabo,Le Grand Livre de l'Histoire de la Guyane - Volume 2,N/A,,bmontabo11,2021,French,Editions Orphie,Matoury,French Guiana,matoury_french_guiana,Nonfiction,,n,#,#,#,372,55.94673229,-20.81345706,
bmontabo,Bernard Montabo,Le grand livre de l'histoire de la Guyane: Des origines à 1848 (Volume 1),N/A,,bmontabo2,2004,French,Editions Orphie,Matoury,French Guiana,matoury_french_guiana,Nonfiction,,n,#,#,#,330,55.94673229,-20.81345706,
bmontabo,Bernard Montabo,L'histoire de la Guyane Tome 2,N/A,,bmontabo3,2004,French,Editions Orphie,Matoury,French Guiana,matoury_french_guiana,Nonfiction,,n,#,#,#,715,55.94673229,-20.81345706,
bmontabo,Bernard Montabo,"La Guyane, un nom, une histoire: Du XVIIe au XIXe siècle (Tome I) (La Guyane, un nom, une histoire, 1)",N/A,,bmontabo6,2011,French,Editions Orphie,Matoury,French Guiana,matoury_french_guiana,Nonfiction,,n,#,#,#,224,55.94673229,-20.81345706,
bmontabo,Bernard Montabo,"La Guyane, un nom, une histoire: Le XXe siècle (Tome II ) (La Guyane, un nom, une histoire, 2)",N/A,,bmontabo7,2011,French,Editions Orphie,Matoury,French Guiana,matoury_french_guiana,Nonfiction,,n,#,#,#,281,55.94673229,-20.81345706,
bmontabo,Bernard Montabo,"Guide encyclopédique de la Guyane - découvrir, comprendre, venir",N/A,,bmontabo8,2012,French,Editions Orphie,Matoury,French Guiana,matoury_french_guiana,Nonfiction,,n,#,#,#,511,55.94673229,-20.81345706,
bmontabo,Bernard Montabo,"La Guyane, un nom, une histoire: Une société coloniale (Tome III) (La Guyane, un nom, une histoire, 3)",N/A,,bmontabo9,2013,French,Editions Orphie,Matoury,French Guiana,matoury_french_guiana,Nonfiction,,n,#,#,#,320,55.94673229,-20.81345706,
